{
  "artifact_version": 1,
  "generated_by": "frozen input: committed to this repository, not produced by any generator in it",
  "source": {
    "n_trees": 10,
    "n_leaves": 48,
    "n_node_leaves": 1,
    "n_branch_leaves": 47
  },
  "meta": {
    "version": 1,
    "source": "the master decision trees and the unit-root/stationarity polarity rule; this artifact is now the only copy",
    "polarity": {
      "adf": {
        "family": "unit_root",
        "h0": "unit_root",
        "reject": "I0"
      },
      "pp": {
        "family": "unit_root",
        "h0": "unit_root",
        "reject": "I0"
      },
      "ers": {
        "family": "unit_root",
        "h0": "unit_root",
        "reject": "I0"
      },
      "kpss": {
        "family": "stationarity",
        "h0": "stationarity",
        "reject": "non_stationary"
      }
    },
    "data_properties_contract": {
      "goal": "univariate|multivariate|structural|cointegration|volatility|causality|distribution_risk|trend_cycle|panel|forecast_workflow (required)",
      "n_series": "integer (= K in the trees' symbols)",
      "integration_orders": "array of I0|I1|I2 (one per series)",
      "cointegration_rank": "integer r (Johansen)",
      "seasonal": "boolean",
      "arch_effects": "boolean",
      "has_break": "boolean",
      "many_predictors": "boolean (dozens or more indicators -> FAVAR)",
      "panel_structure": "boolean",
      "choice": "string discriminator for modeling-choice trees (see each node's question)"
    }
  },
  "trees": [
    {
      "id": "A",
      "name": "univariate-forecast",
      "entry": {
        "goal": "univariate"
      },
      "root": "A_seasonal",
      "nodes": {
        "A_seasonal": {
          "question": "Is there seasonality? (seasonal unit-root test)",
          "reads": "seasonal",
          "precondition": [
            "c01_preparation_prechecks/seasonal_unit_roots.run_hegy_test",
            "c01_preparation_prechecks/seasonal_unit_roots.run_ch_test"
          ],
          "branches": [
            {
              "when": {
                "truthy": false
              },
              "leaf": {
                "tool_fns": "run_auto_arima",
                "card_id": 7,
                "rationale": "Non-seasonal: auto_arima baseline (endogenous d). Alternatives: run_ets (ETS state-space), run_theta (cheap robust benchmark).",
                "source": "Box-Jenkins· Hyndman-Khandakar 2008"
              }
            },
            {
              "when": {
                "truthy": true
              },
              "leaf": {
                "tool_fns": [
                  "run_auto_arima",
                  "run_tbats",
                  "run_prophet"
                ],
                "card_id": 7,
                "rationale": "Seasonal: run_auto_arima(seasonal=TRUE) or run_ets. MULTIPLE/high-freq/non-integer seasonalities -> run_tbats; seasonalities+holidays+changepoints -> run_prophet.",
                "source": "De Livera-Hyndman-Snyder 2011· Taylor-Letham 2018"
              }
            }
          ]
        }
      }
    },
    {
      "id": "FAVAR",
      "name": "favar-recipe",
      "entry": {
        "goal": "multivariate",
        "many_predictors": true
      },
      "root": "FAVAR_leaf",
      "nodes": {
        "FAVAR_leaf": {
          "leaf": {
            "tool_fns": [
              "df_fit",
              "vr_fit",
              "vr_irf",
              "vr_fevd"
            ],
            "card_id": 15,
            "rationale": "Dozens to hundreds of indicators: extract K factors (df_fit) -> augmented VAR [factors, observables] (vr_fit) -> structural IRF/FEVD (vr_irf/vr_fevd). Solves the degrees-of-freedom problem without Bayesian shrinkage.",
            "warn": "Generated regressors (Pagan 1984): the factors are ESTIMATED -> IRF standard errors are understated; for fewer than 20 variables prefer BVAR (#12).",
            "source": "Bernanke-Boivin-Eliasz 2005 QJE· Stock-Watson 2016"
          }
        }
      }
    },
    {
      "id": "B",
      "name": "multivariate-VAR-VECM",
      "entry": {
        "goal": [
          "multivariate",
          "cointegration"
        ],
        "min_series": 2
      },
      "root": "B_step1",
      "nodes": {
        "B_step1": {
          "question": "Order of integration per series (confirmatory ADF + KPSS)",
          "reads": "integration_orders",
          "precondition": [
            "c01_preparation_prechecks/unit_root_normality.run_adf_test",
            "c01_preparation_prechecks/unit_root_normality.run_kpss_test"
          ],
          "branches": [
            {
              "when": {
                "all": "I0"
              },
              "leaf": {
                "tool_fns": [
                  "vr_lag_select",
                  "vr_fit"
                ],
                "card_id": 11,
                "rationale": "ALL I(0) -> VAR IN LEVELS: vr_lag_select (lag AIC/HQ/SC/FPE) -> vr_fit -> stability GATE (vr_fit.stable). Structural -> goal=structural (Tree B2).",
                "source": "Lütkepohl 2005"
              }
            },
            {
              "when": {
                "all": "I1"
              },
              "goto": "B_johansen"
            },
            {
              "when": {
                "mixed": [
                  "I0",
                  "I1"
                ],
                "exclude": "I2"
              },
              "leaf": {
                "tool_fns": [
                  "ardl_fit",
                  "ardl_bounds_f"
                ],
                "card_id": 25,
                "rationale": "MIXED I(0)/I(1) (no I(2)) -> ARDL bounds: ardl_fit/ardl_auto -> ardl_bounds_f (F). F>upper ⇒ cointegration; F<lower ⇒ none; in between ⇒ inconclusive.",
                "source": "Pesaran-Shin-Smith 2001"
              }
            },
            {
              "when": {
                "contains": "I2"
              },
              "leaf": {
                "tool_fns": [],
                "card_id": 1,
                "guard": true,
                "rationale": "An I(2) series is present -> NEITHER classical Johansen NOR ARDL bounds hold as they stand. Take the first difference of the I(2) series and re-test (Step 1).",
                "source": "Pesaran-Shin-Smith 2001 (regressors I(0)/I(1), not I(2))"
              }
            }
          ]
        },
        "B_johansen": {
          "question": "Johansen cointegration rank r (sequentially from r=0)",
          "reads": "cointegration_rank",
          "precondition": "c05_cointegration/johansen_restricted_vecm.coint_johansen",
          "branches": [
            {
              "when": {
                "eq": 0
              },
              "leaf": {
                "tool_fns": "vr_fit",
                "card_id": 11,
                "rationale": "r=0 (no cointegration) -> VAR IN FIRST DIFFERENCES (difference each series, then vr_fit).",
                "warn": "NEVER a VAR in levels here — spurious regression (Granger-Newbold 1974).",
                "source": "Enders 2015· Hamilton 1994"
              }
            },
            {
              "when": {
                "between": [
                  1,
                  "K-1"
                ]
              },
              "leaf": {
                "tool_fns": [
                  "coint_johansen_vecm",
                  "vr_vecm_to_var"
                ],
                "card_id": 23,
                "rationale": "0<r<K (cointegration) -> VECM: coint_johansen_vecm (restricted VECM at rank r). IRF/FEVD: bridge to a level-VAR with vr_vecm_to_var(z, r) -> vr_irf/vr_fevd.",
                "source": "Johansen 1995· Lütkepohl 2005 §6.3"
              }
            },
            {
              "when": {
                "eq": "K"
              },
              "leaf": {
                "tool_fns": "run_adf_test",
                "card_id": 1,
                "recheck": true,
                "rationale": "r=K (full rank) -> the series were effectively I(0); re-test stationarity (Step 1) and go to a VAR in levels.",
                "source": "Johansen 1995 (full rank ⇒ stationary VAR)"
              }
            }
          ]
        }
      }
    },
    {
      "id": "B2",
      "name": "svar-identification",
      "entry": {
        "goal": "structural"
      },
      "root": "B2_id",
      "nodes": {
        "B2_id": {
          "question": "Which identification strategy? choice ∈ recursive|long_run|sign|changes_in_volatility|independence|non_gaussian|local_projection (a theoretical choice, not a data test)",
          "reads": "choice",
          "branches": [
            {
              "when": {
                "is": "recursive"
              },
              "leaf": {
                "tool_fns": [
                  "vr_svar",
                  "svar_id_cholesky"
                ],
                "card_id": 20,
                "rationale": "A clear contemporaneous ordering -> Cholesky/recursive. ⚠ the ordering IS an assumption (test its robustness).",
                "source": "Sims 1980· CEE 1999"
              }
            },
            {
              "when": {
                "is": "long_run"
              },
              "leaf": {
                "tool_fns": "vr_bq",
                "card_id": 19,
                "rationale": "Long-run restriction (e.g. a demand shock neutral on output) -> Blanchard-Quah (LRIM).",
                "source": "Blanchard-Quah 1989"
              }
            },
            {
              "when": {
                "is": "sign"
              },
              "leaf": {
                "tool_fns": "sgn_uhlig_reject",
                "card_id": 21,
                "rationale": "A-priori signs of the responses (not zero restrictions) -> sign restrictions (Uhlig reject/penalty, RWZ).",
                "source": "Uhlig 2005· Rubio-Ramírez-Waggoner-Zha 2010"
              }
            },
            {
              "when": {